The Perfect Storm;2000;An unusually intense storm pattern catches some commercial fishermen unaware and puts them in mortal danger.;182 618 434;146 100 000;328 718 434
Crocodile Dundee;1986;An American reporter goes to the Australian outback to meet an eccentric crocodile poacher and invites him to New York City.;174 803 506;153 400 000;328 203 506
Crazy Alien;2019;A monkey trainer whose act goes wrong after an alien crash lands on Earth and injures his monkey. Desperate to perform the act, he attempts to train the alien instead, but is punished after the alien regains his powers.;327 598 891;327 598 891;77 112 971
Se7en;1995;Two detectives, a rookie and a veteran, hunt a serial killer who uses the seven deadly sins as his motives.;100 125 643;227 207 916;327 333 559
John Wick: Chapter 3 - Parabellum;2019;John Wick is on the run after killing a member of the international assassins' guild, and with a $14 million price tag on his head, he is the target of hit men and women everywhere.;171 015 687;156 266 092;327 281 779
The Devil Wears Prada;2006;A smart but sensible new graduate lands a job as an assistant to Miranda Priestly, the demanding editor-in-chief of a high fashion magazine.;124 740 460;201 965 655;326 706 115
Taken 3;2014;Accused of a ruthless murder he never committed or witnessed, Bryan Mills goes on the run and brings out his particular set of skills to find the true killer and clear his name.;89 256 424;237 222 717;326 479 141
The Hunchback of Notre Dame;1996;A deformed bell-ringer must assert his independence from a vicious government minister in order to help his friend, a gypsy dancer.;100 138 851;225 200 000;325 338 851
A Christmas Carol;2009;An animated retelling of Charles Dickens' classic novel about a Victorian-era miser taken on a journey of self-redemption, courtesy of several mysterious Christmas apparitions.;137 855 863;187 430 783;325 286 646
The SpongeBob Movie: Sponge Out of Water;2015;When a diabolical pirate above the sea steals the secret Krabby Patty formula, SpongeBob and his nemesis Plankton must team up in order to get it back.;162 994 032;162 192 000;325 186 032
Schindler's List;1993;In German-occupied Poland during World War II, industrialist Oskar Schindler gradually becomes concerned for his Jewish workforce after witnessing their persecution by the Nazis.;96 898 818;225 262 427;322 161 245
Megamind;2010;Evil genius Megamind finally defeats his do-gooder nemesis, Metro Man, but is left without a purpose in a superhero-free world.;148 415 853;173 469 912;321 885 765
The Conjuring 2;2016;Ed and Lorraine Warren travel to North London to help a single mother raising four children alone in a house plagued by a supernatural spirit.;102 516 140;219 318 211;321 834 351
Green Book;2018;A working-class Italian-American bouncer becomes the driver for an African-American classical pianist on a tour of venues through the 1960s American South.;85 080 171;236 672 485;321 752 656
Lethal Weapon 3;1992;Martin Riggs and Roger Murtaugh pursue a former LAPD officer who uses his knowledge of police procedure and policies to steal and sell confiscated guns and ammunition to local street gangs.;144 731 527;177 000 000;321 731 527
Robin Hood;2010;In twelfth-century England, Robin Longstride and his band of marauders confront corruption in a local village and lead an uprising against the crown that will forever alter the balance of world power.;105 269 730;216 400 011;321 669 741
Inglourious Basterds;2009;In Nazi-occupied France during World War II, a plan to assassinate Nazi leaders by a group of Jewish U.S. soldiers coincides with a theatre owner's vengeful plans for the same.;120 540 719;200 917 028;321 457 747
101 Dalmatians;1996;An evil high-fashion designer plots to steal dalmatian puppies in order to make an extravagant fur coat but creates an extravagant mess instead.;136 189 294;184 500 000;320 689 294
The Conjuring;2013;Paranormal investigators Ed and Lorraine Warren work to help a family terrorized by a dark presence in their farmhouse.;137 446 368;182 959 874;320 406 242
Fatal Attraction;1987;A married man's one-night stand comes back to haunt him when that lover begins to stalk him and his family.;156 645 693;163 500 000;320 145 693
Sonic the Hedgehog;2020;After discovering a small, blue, fast hedgehog, a small-town police officer must help him defeat an evil genius who wants to do experiments on him.;148 974 665;170 741 018;319 715 683
The Last Airbender;2010;Follows the adventures of Aang, a young successor to a long line of Avatars, who must master all four elements and stop the Fire Nation from enslaving the Water Tribes and the Earth Kingdom.;131 772 187;187 941 694;319 713 881
The Proposal;2009;A pushy boss forces her young assistant to marry her in order to keep her visa status in the U.S. and avoid deportation to Canada.;163 958 031;153 417 000;317 375 031
A Beautiful Mind;2001;After John Nash, a brilliant but asocial mathematician, accepts secret work in cryptography, his life takes a turn for the nightmarish.;170 742 341;146 048 916;316 791 257
Beverly Hills Cop;1984;A freewheeling Detroit cop pursuing a murder investigation finds himself dealing with the very different culture of Beverly Hills.;234 760 478;81 600 000;316 360 478
The Polar Express;2004;On Christmas Eve, a young boy embarks on a magical adventure to the North Pole on the Polar Express, while learning about friendship, bravery, and the spirit of Christmas.;188 969 804;126 279 964;315 249 768
Air Force One;1997;Communist radicals hijack Air Force One with the U.S. President and his family on board. The Vice President negotiates from Washington D.C., while the President, a veteran, fights to rescue the hostages on board.;172 956 409;142 200 000;315 156 409
The Expendables 2;2012;Mr. Church reunites the Expendables for what should be an easy paycheck, but when one of their men is murdered on the job, their quest for revenge puts them deep in enemy territory and up against an unexpected threat.;85 028 192;229 947 763;314 975 955
Chicken Little;2005;After ruining his reputation with the town, a courageous chicken must come to the rescue of his fellow citizens when aliens start an invasion.;135 386 665;179 046 172;314 432 837
As Good as It Gets;1997;A single mother and waitress, a misanthropic author, and a gay artist form an unlikely friendship after the artist is assaulted in a robbery.;148 478 011;165 700 000;314 178 011
Maze Runner: The Scorch Trials;2015;After having escaped the Maze, the Gladers now face a new set of challenges on the open roads of a desolate landscape filled with unimaginable obstacles.;81 697 192;230 598 864;312 296 056
Resident Evil: The Final Chapter;2016;Alice returns to where the nightmare began: The Hive in Raccoon City, where the Umbrella Corporation is gathering its forces for a final strike against the only remaining survivors of the apocalypse.;26 830 068;285 412 558;312 242 626
The Lego Batman Movie;2017;A cooler-than-ever Bruce Wayne must deal with the usual suspects as they plan to rule Gotham City, while discovering that he has accidentally adopted a teenage orphan who wishes to become his sidekick.;175 936 671;136 200 000;312 136 671
Austin Powers: The Spy Who Shagged Me;1999;Dr. Evil is back and has invented a new time machine that allows him to go back to the 1960s and steal Austin Powers' mojo, inadvertently leaving him "shagless".;206 040 086;105 976 842;312 016 928
Knives Out;2019;A detective investigates the death of the patriarch of an eccentric, combative family.;165 363 234;146 242 347;311 605 581
Ocean's Thirteen;2007;Danny Ocean rounds up the boys for a third heist after casino owner Willy Bank double-crosses one of the original eleven, Reuben Tishkoff.;117 154 724;194 157 900;311 312 624
Little Fockers;2010;Family-patriarch Jack Byrnes wants to appoint a successor. Does his son-in-law, the male nurse Greg Focker, have what it takes?;148 438 600;162 211 985;310 650 585
Bolt;2008;The canine star of a fictional sci-fi/action show that believes his powers are real embarks on a cross country trek to save his co-star from a threat he believes is just as real.;114 053 579;195 926 415;309 979 994
Ransom;1996;Multi-millionaire Tom Mullen's son is kidnapped, but after initially agreeing to pay the ransom Mullen then decides to use the ransom money as a bounty.;136 492 681;173 000 000;309 492 681
Runaway Bride;1999;A reporter is assigned to write a story about a woman who has left a string of fiancés at the altar.;152 257 509;157 202 783;309 460 292
The Blind Side;2009;The story of Michael Oher, a homeless and traumatized boy who became an All-American football player and first-round NFL draft pick with the help of a caring woman and her family.;255 982 860;53 248 834;309 231 694
The Ex-File 3: The Return of The Exes;2017;A couples relationship is tested by the untimely appearances of their exes!;838 959;306 753 468;307 592 427
The Fault in Our Stars;2014;Two teenage cancer patients begin a life-affirming journey to visit a reclusive author in Amsterdam.;124 872 350;182 294 484;307 166 834
The Pursuit of Happyness;2006;A struggling salesman takes custody of his son as he's poised to begin a life-changing professional career.;163 566 459;143 561 166;307 127 625
Rise of the Guardians;2012;When the evil spirit Pitch launches an assault on Earth, the Immortal Guardians team up to protect the innocence of children all around the world.;103 412 758;203 528 912;306 941 670
Close Encounters of the Third Kind;1977;Roy Neary, an Indiana electric lineman, finds his quiet and ordinary daily life turned upside down after a close encounter with a UFO, spurring him to an obsessed cross-country quest for answers as a momentous event approaches.;135 189 114;171 700 000;306 889 114
Chicago;2002;Two death-row murderesses develop a fierce rivalry while competing for publicity, celebrity, and a sleazy lawyer's attention.;170 687 518;136 089 214;306 776 732
Annabelle: Creation;2017;Twelve years after the tragic death of their little girl, a doll-maker and his wife welcome a nun and several girls from a shuttered orphanage into their home, where they become the target of the doll-maker's possessed creation, Annabelle.;102 092 201;204 423 683;306 515 884
Wonder;2017;Based on the New York Times bestseller, this movie tells the incredibly inspiring and heartwarming story of August Pullman, a boy with facial differences who enters the fifth grade, attending a mainstream elementary school for the first time.;132 422 809;173 786 480;306 209 289
Skyscraper;2018;A security expert must infiltrate a burning skyscraper, 225 stories above ground, when his family is trapped inside by criminals.;68 420 120;236 448 841;304 868 961
A Good Day to Die Hard;2013;John McClane travels to Russia to help out his seemingly wayward son, Jack, only to discover that Jack is a CIA operative working undercover, causing the father and son to team up against underworld forces.;67 349 198;237 304 984;304 654 182
Mulan;1998;To save her father from death in the army, a young maiden secretly goes in his place and becomes one of China's greatest heroines in the process.;120 620 254;183 700 000;304 320 254
Dangal;2016;Former wrestler Mahavir Singh Phogat and his two wrestler daughters struggle towards glory at the Commonwealth Games in the face of societal oppression.;12 391 761;291 331 875;303 723 636
Passengers;2016;A malfunction in a sleeping pod on a spacecraft traveling to a distant colony planet wakes one passenger 90 years early.;100 014 699;203 129 453;303 144 152
Battleship;2012;A fleet of ships is forced to do battle with an armada of unknown origins in order to discover and thwart their destructive goals.;65 422 625;237 602 860;303 025 485
Liar Liar;1997;A fast-track lawyer can't lie for 24 hours due to his son's birthday wish after disappointing him for the last time.;181 410 615;121 300 000;302 710 615
G.I. Joe: The Rise of Cobra;2009;An elite military unit comprised of special operatives known as G.I. Joe, operating out of The Pit, takes on an evil organization led by a notorious arms dealer.;150 201 498;152 267 519;302 469 017
Wrath of the Titans;2012;Perseus braves the treacherous underworld to rescue his father, Zeus, captured by his son, Ares, and brother Hades who unleash the ancient Titans upon the world.;83 670 083;218 300 000;301 970 083
Fantastic 4: Rise of the Silver Surfer;2007;The Fantastic Four learn that they aren't the only super-powered beings in the universe when they square off against the powerful Silver Surfer and the planet-eating Galactus.;131 921 738;169 991 393;301 913 131
Hook;1991;When Captain James Hook kidnaps his children, an adult Peter Pan must return to Neverland and reclaim his youthful spirit in order to challenge his old enemy.;119 654 823;181 200 000;300 854 823
Superman;1978;An alien orphan is sent from his dying planet to Earth, where he grows up to become his adoptive home's first and greatest superhero.;134 478 449;166 000 000;300 478 449
Rocky IV;1985;Rocky Balboa proudly holds the world heavyweight boxing championship, but a new challenger has stepped forward: Drago, a six-foot-four, 261-pound fighter who has the backing of the Soviet Union.;127 873 716;172 600 000;300 473 716
Rambo: First Blood Part II;1985;Rambo returns to the jungles of Vietnam on a mission to infiltrate an enemy base-camp and rescue the American POWs still held captive there.;150 415 432;149 985 000;300 400 432
Resident Evil: Afterlife;2010;While still out to destroy the evil Umbrella Corporation, Alice joins a group of survivors living in a prison surrounded by the infected who also want to relocate to the mysterious but supposedly unharmed safe haven known only as Arcadia.;60 128 566;240 099 518;300 228 084
Van Helsing;2004;The famed monster hunter is sent to Transylvania to stop Count Dracula, who is using Dr. Frankenstein's research and a werewolf for nefarious purposes.;120 177 084;179 980 554;300 157 638
Stuart Little;1999;The Little family adopt a charming young mouse named Stuart, but the family cat wants rid of him.;140 035 367;160 100 000;300 135 367
Beverly Hills Cop II;1987;Axel Foley returns to Beverly Hills to help Taggart and Rosewood investigate Chief Bogomil's near-fatal shooting and the series of "alphabet crimes" associated with it.;153 665 036;146 300 000;299 965 036
Alice Through the Looking Glass;2016;Alice is appointed to save her beloved Mad Hatter from deadly grief by travelling back to the past, but this means fatally harming Time himself, the noble clockwork man with the device needed to save the Hatter's family from the Red Queen.;77 041 381;222 779 417;299 820 798
My Best Friend's Wedding;1997;When a woman's long-time friend reveals he's engaged, she realizes she loves him herself and sets out to get him, with only days before the wedding.;127 120 029;172 168 576;299 288 605
Real Steel;2011;In the near future, robot boxing is a top sport. A struggling ex-boxer feels he's found a champion in a discarded robot.;85 468 508;213 800 000;299 268 508
Horton Hears a Who!;2008;Horton the Elephant struggles to protect a microscopic community from his neighbors who refuse to believe it exists.;154 529 439;144 043 360;298 572 799
Ocean's Eight;2018;Debbie Ocean gathers an all-female crew to attempt an impossible heist at New York City's yearly Met Gala.;140 295 726;157 500 000;297 795 726
A Quiet Place Part II;2020;Following the events at home, the Abbott family now face the terrors of the outside world. Forced to venture into the unknown, they realize the creatures that hunt by sound are not the only threats lurking beyond the sand path.;160 072 261;137 300 000;297 372 261
The Divergent Series: Insurgent;2015;Beatrice Prior must confront her inner demons and continue her fight against a powerful alliance which threatens to tear her society apart with the help from others on her side.;130 179 072;166 823 455;297 002 527
Look Who's Talking;1989;After a single, career-minded woman is left on her own to give birth to the child of a married man, she finds a new romantic chance in a cab driver. Meanwhile, the point-of-view of the newborn baby is narrated through voice-over.;140 088 813;156 911 000;296 999 813
Austin Powers in Goldmember;2002;Upon learning that his father has been kidnapped, Austin Powers must travel to 1975 and defeat the aptly named villain Goldmember, who is working with Dr. Evil.;213 307 889;83 630 912;296 938 801
Ghostbusters;1984;Three parapsychologists forced out of their university funding set up shop as a unique ghost removal service in New York City, attracting frightened yet skeptical customers.;243 578 797;53 000 000;296 578 797
Miss Peregrine's Home for Peculiar Children;2016;When Jacob (Asa Butterfield) discovers clues to a mystery that stretches across time, he finds Miss Peregrine's Home for Peculiar Children. But the danger deepens after he gets to know the residents and learns about their special powers.;87 242 834;209 239 612;296 482 446
X-Men;2000;In a world where mutants (evolved super-powered humans) exist and are discriminated against, two groups form for an inevitable clash: the supremacist Brotherhood, and the pacifist X-Men.;157 299 718;139 039 810;296 339 528
Ferdinand;2017;After Ferdinand, a bull with a big heart, is mistaken for a dangerous beast, he is captured and torn from his home. Determined to return to his family, he rallies a misfit team on the ultimate adventure.;84 410 380;211 658 819;296 069 199
Shutter Island;2010;In 1954, a U.S. Marshal investigates the disappearance of a murderer who escaped from a hospital for the criminally insane.;128 012 934;166 792 763;294 805 697
Doctor Dolittle;1998;A doctor discovers that he can communicate with animals.;144 156 605;150 300 000;294 456 605
Bee Movie;2007;Barry B. Benson, a bee just graduated from college, is disillusioned at his lone career choice: making honey. On a special trip outside the hive, Barry's life is saved by Vanessa, a florist in New York City. As their relationship blossoms, he discovers humans actually eat honey, and subsequently decides to sue them.;126 631 277;166 883 059;293 514 336
Salt;2010;A CIA agent goes on the run after a defector accuses her of being a Russian spy.;118 311 368;175 191 986;293 503 354
G-Force;2009;A specially trained squad of guinea pigs is dispatched to stop a diabolical billionaire from taking over the world.;119 436 770;173 381 128;292 817 898
The Departed;2006;An undercover cop and a mole in the police attempt to identify each other while infiltrating an Irish gang in South Boston.;132 399 394;159 081 058;291 480 452
What Lies Beneath;2000;The wife of a university research scientist believes that her lakeside Vermont home is haunted by a ghost - or that she is losing her mind.;155 464 351;135 956 000;291 420 351
Pacific Rim: Uprising;2018;Jake Pentecost, son of Stacker Pentecost, reunites with Mako Mori to lead a new generation of Jaeger pilots, including rival Lambert and 15-year-old hacker Amara, against a new Kaiju threat.;59 874 525;231 055 623;290 930 148
The Bourne Supremacy;2004;When Jason Bourne is framed for a CIA operation gone awry, he is forced to resume his former life as a trained assassin to survive.;176 241 941;114 593 328;290 835 269
Sex and the City 2;2010;While wrestling with the pressures of life, love, and work in Manhattan, Carrie, Miranda, and Charlotte join Samantha for a trip to Abu Dhabi (United Arab Emirates), where Samantha's ex is filming a new movie.;95 347 692;195 397 363;290 745 055
Shakespeare in Love;1998;The world's greatest ever playwright, William Shakespeare, is young, out of ideas and short of cash, but meets his ideal woman and is inspired to write one of his most famous plays.;100 317 794;189 000 000;289 317 794
Divergent;2014;In a world divided by factions based on virtues, Tris learns she's Divergent and won't fit in. When she discovers a plot to destroy Divergents, Tris and the mysterious Four must find out what makes Divergents dangerous before it's too late.;150 947 895;137 937 923;288 885 818
Coming to America;1988;An extremely pampered African prince travels to Queens, New York, and goes undercover to find a wife that he can respect for her intelligence and strong will.;128 152 301;160 600 000;288 752 301
Wedding Crashers;2005;John Beckwith and Jeremy Grey, a pair of committed womanizers who sneak into weddings to take advantage of the romantic tinge in the air, find themselves at odds with one another when John meets and falls for Claire Cleary.;209 273 411;79 211 724;288 485 135
Bridesmaids;2011;Competition between the maid of honor and a bridesmaid, over who is the bride's best friend, threatens to upend the life of an out-of-work pastry chef.;169 106 725;119 276 798;288 383 523
Maze Runner: The Death Cure;2018;Young hero Thomas embarks on a mission to find a cure for a deadly disease known as "The Flare".;58 032 443;230 142 892;288 175 335
Casper;1995;An afterlife therapist and his daughter meet a friendly young ghost when they move into a crumbling mansion in order to rid the premises of wicked spirits.;100 328 194;187 600 000;287 928 194
American Pie 2;2001;Jim and his friends are now in college, and they decide to meet up at the beach house for some fun.;145 103 595;142 450 000;287 553 595
Pitch Perfect 2;2015;After a humiliating command performance at The Kennedy Center, the Barden Bellas enter an international competition that no American group has ever won in order to regain their status and right to perform.;184 296 230;102 847 849;287 144 079
The Green Mile;1999;The lives of guards on Death Row are affected by one of their charges: a black man accused of child murder and rape, yet who has a mysterious gift.;136 801 374;150 000 000;286 801 374
Oblivion;2013;A veteran assigned to extract Earth's remaining resources begins to question what he knows about his mission and himself.;89 107 235;197 061 337;286 168 572
Elysium;2013;In the year 2154, the very wealthy live on a man-made space station while the rest of the population resides on a ruined Earth. A man takes on a mission that could bring equality to the polarized worlds.;93 050 117;193 090 583;286 140 700
Lethal Weapon 4;1998;With personal crises and age weighing in on them, LAPD officers Riggs and Murtaugh must contend with deadly Chinese triads that are trying to free their former leaders out of prison and onto American soil.;130 444 603;155 000 000;285 444 603
John Carter;2012;Transported to Barsoom, a Civil War vet discovers a barren planet seemingly inhabited by 12-foot tall barbarians. Finding himself prisoner of these creatures, he escapes, only to encounter Woola and a princess in desperate need of a savior.;73 078 100;211 061 000;284 139 100
Turbo;2013;A freak accident might just help an everyday garden snail achieve his biggest dream: winning the Indy 500.;83 028 128;199 542 554;282 570 682
Paddington;2014;A young Peruvian bear travels to London in search of a home. Finding himself lost and alone at Paddington Station, he meets the kindly Brown family, who offer him a temporary haven.;76 271 832;206 105 851;282 377 683
Bridget Jones's Diary;2001;Bridget Jones is determined to improve herself while she looks for love in a year in which she keeps a personal diary.;71 543 427;210 452 183;281 995 610
The Tourist;2010;Revolves around Frank, an American tourist visiting Italy to mend a broken heart. Elise is an extraordinary woman who deliberately crosses his path.;67 631 157;211 149 284;278 780 441
Split;2016;Three girls are kidnapped by a man with a diagnosed 23 distinct personalities. They must try to escape before the apparent emergence of a frightful new 24th.;138 291 365;140 163 052;278 454 417
Scary Movie;2000;A year after disposing of the body of a man they accidentally killed, a group of dumb teenagers are stalked by a bumbling serial killer.;157 019 771;121 000 000;278 019 771
xXx;2002;An extreme sports athlete, Xander Cage, is recruited by the government on a special mission.;142 109 382;135 339 000;277 448 382
The Bourne Legacy;2012;An expansion of the universe from Robert Ludlum's novels, centered on a new hero whose stakes have been triggered by the events of the previous three films.;113 203 870;162 940 880;276 144 750
Mr. Peabody & Sherman;2014;The time-travelling adventures of an advanced canine and his adopted son, as they endeavor to fix a time rift they created.;111 506 430;164 191 609;275 698 039
Scooby-Doo;2002;After an acrimonious break up, the Mystery Inc. gang are individually brought to an island resort to investigate strange goings on.;153 322 074;122 356 539;275 678 613
Lincoln;2012;As the American Civil War continues to rage, America's president struggles with continuing carnage on the battlefield as he fights with many inside his own cabinet on the decision to emancipate the slaves.;182 207 973;93 085 477;275 293 450
Lara Croft: Tomb Raider;2001;Video game adventurer Lara Croft comes to life in a movie where she races against time and villains to recover powerful ancient artifacts.;131 168 070;143 535 270;274 703 340
Tomb Raider;2018;Lara Croft (Alicia Vikander), the fiercely independent daughter of a missing adventurer, must push herself beyond her limits when she discovers the island where her father, Lord Richard Croft (Dominic West) disappeared.;58 250 803;216 400 000;274 650 803
The Expendables;2010;A CIA operative hires a team of mercenaries to eliminate a Latin dictator and a renegade CIA agent.;103 068 524;171 401 870;274 470 394
Cloudy with a Chance of Meatballs 2;2013;Flint Lockwood now works at The Live Corp Company for his idol Chester V. But he's forced to leave his post when he learns that his most infamous machine is still operational, and is churning out menacing food-animal hybrids.;119 793 567;154 532 382;274 325 949
