Avatar;2009;A paraplegic Marine dispatched to the moon Pandora on a unique mission becomes torn between following his orders and protecting the world he feels is his home.;760 507 625;2 086 889 714;2 847 397 339
Avengers: Endgame;2019;After the devastating events of Avengers: Infinity War, the universe is in ruins. With the help of remaining allies, the Avengers assemble once more in order to reverse Thanos' actions and restore balance to the universe.;858 373 000;1 939 128 328;2 797 501 328
Titanic;1997;A seventeen-year-old aristocrat falls in love with a kind but poor artist aboard the luxurious, ill-fated R.M.S. Titanic.;659 363 944;1 542 283 320;2 201 647 264
Star Wars: Episode VII - The Force Awakens;2015;As a new threat to the galaxy rises, Rey, a desert scavenger, and Finn, an ex-stormtrooper, must join Han Solo and Chewbacca to search for the one hope of restoring peace.;936 662 225;1 132 859 475;2 069 521 700
Avengers: Infinity War;2018;The Avengers and their allies must be willing to sacrifice all in an attempt to defeat the powerful Thanos before his blitz of devastation and ruin puts an end to the universe.;678 815 482;1 369 544 272;2 048 359 754
Spider-Man: No Way Home;2021;With Spider-Man's identity now revealed, Peter asks Doctor Strange for help. When a spell goes wrong, dangerous foes from other worlds start to appear, forcing Peter to discover what it truly means to be Spider-Man.;804 792 418;1 096 439 073;1 901 231 491
Jurassic World;2015;A new theme park, built on the original site of Jurassic Park, creates a genetically modified hybrid dinosaur, the Indominus Rex, which escapes containment and goes on a killing spree.;653 406 625;1 018 130 819;1 671 537 444
The Lion King;2019;After the murder of his father, a young lion prince flees his kingdom only to learn the true meaning of responsibility and bravery.;543 638 043;1 119 612 444;1 663 250 487
The Avengers;2012;Earth's mightiest heroes must come together and learn to fight as a team if they are going to stop the mischievous Loki and his alien army from enslaving humanity.;623 357 910;895 457 605;1 518 815 515
Furious 7;2015;Deckard Shaw seeks revenge against Dominic Toretto and his family for his comatose brother.;353 007 020;1 162 334 379;1 515 341 399
Frozen II;2019;Anna, Elsa, Kristoff, Olaf and Sven leave Arendelle to travel to an ancient, autumn-bound forest of an enchanted land. They set out to find the origin of Elsa's powers in order to save their kingdom.;477 373 578;972 653 355;1 450 026 933
Avengers: Age of Ultron;2015;When Tony Stark and Bruce Banner try to jump-start a dormant peacekeeping program called Ultron, things go horribly wrong and it's up to Earth's mightiest heroes to stop the villainous Ultron from enacting his terrible plan.;459 005 868;943 803 672;1 402 809 540
Black Panther;2018;T'Challa, heir to the hidden but advanced kingdom of Wakanda, must step forward to lead his people into a new future and must confront a challenger from his country's past.;700 426 566;647 171 407;1 347 597 973
Harry Potter and the Deathly Hallows: Part 2;2011;Harry, Ron, and Hermione search for Voldemort's remaining Horcruxes in their effort to destroy the Dark Lord as the final battle rages on at Hogwarts.;381 447 587;960 912 354;1 342 359 942
Star Wars: Episode VIII - The Last Jedi;2017;The Star Wars saga continues as new heroes and galactic legends go on an epic adventure, unlocking mysteries of the Force and shocking revelations of the past.;620 181 382;712 517 448;1 332 698 830
Jurassic World: Fallen Kingdom;2018;When the island's dormant volcano begins roaring to life, Owen and Claire mount a campaign to rescue the remaining dinosaurs from this extinction-level event.;417 719 760;892 746 536;1 310 466 296
Frozen;2013;When the newly crowned Queen Elsa accidentally uses her power to turn things into ice to curse her home in infinite winter, her sister Anna teams up with a mountain man, his playful reindeer, and a snowman to change the weather condition.;400 953 009;880 555 091;1 281 508 100
Beauty and the Beast;2017;A selfish Prince is cursed to become a monster for the rest of his life, unless he learns to fall in love with a beautiful young woman he keeps prisoner.;504 481 165;769 095 055;1 273 576 220
Incredibles 2;2018;The Incredibles family takes on a new mission which involves a change in family roles: Bob Parr (Mr. Incredible) must manage the house while his wife Helen (Elastigirl) goes out to save the world.;608 581 744;634 507 500;1 243 089 244
The Fate of the Furious;2017;When a mysterious woman seduces Dominic Toretto into the world of terrorism and a betrayal of those closest to him, the crew face trials that will test them as never before.;226 008 385;1 009 996 733;1 236 005 118
Iron Man 3;2013;When Tony Stark's world is torn apart by a formidable terrorist called the Mandarin, he starts an odyssey of rebuilding and retribution.;409 013 994;805 797 258;1 214 811 252
Minions;2015;Minions Stuart, Kevin, and Bob are recruited by Scarlet Overkill, a supervillain who, alongside her inventor husband Herb, hatches a plot to take over the world.;336 045 770;823 398 892;1 159 444 662
Captain America: Civil War;2016;Political involvement in the Avengers' affairs causes a rift between Captain America and Iron Man.;408 084 349;745 253 147;1 153 337 496
Aquaman;2018;Arthur Curry, the human-born heir to the underwater kingdom of Atlantis, goes on a quest to prevent a war between the worlds of ocean and land.;335 104 314;813 424 079;1 148 528 393
The Lord of the Rings: The Return of the King;2003;Gandalf and Aragorn lead the World of Men against Sauron's army to draw his gaze from Frodo and Sam as they approach Mount Doom with the One Ring.;378 251 207;768 185 007;1 146 436 214
Spider-Man: Far from Home;2019;Following the events of Avengers: Endgame, Spider-Man must step up to take on new threats in a world that has changed forever.;390 532 085;741 395 911;1 131 927 996
Captain Marvel;2019;Carol Danvers becomes one of the universe's most powerful heroes when Earth is caught in the middle of a galactic war between two alien races.;426 829 839;701 633 133;1 128 462 972
Transformers: Dark of the Moon;2011;The Autobots learn of a Cybertronian spacecraft hidden on the moon, and race against the Decepticons to reach it and to learn its secrets.;352 390 543;771 403 536;1 123 794 079
Skyfall;2012;James Bond's loyalty to M is tested when her past comes back to haunt her. When MI6 comes under attack, 007 must track down and destroy the threat, no matter how personal the cost.;304 360 277;804 209 222;1 108 569 499
Transformers: Age of Extinction;2014;When humanity allies with a bounty hunter in pursuit of Optimus Prime, the Autobots turn to a mechanic and his family for help.;245 439 076;858 614 996;1 104 054 072
Jurassic Park;1993;A pragmatic paleontologist touring an almost complete theme park on an island in Central America is tasked with protecting a couple of kids after a power failure causes the park's cloned dinosaurs to run loose.;404 214 720;695 484 283;1 099 699 003
The Dark Knight Rises;2012;Eight years after the Joker's reign of anarchy, Batman, with the help of the enigmatic Catwoman, is forced from his exile to save Gotham City from the brutal guerrilla terrorist Bane.;448 149 584;633 003 513;1 081 153 097
Joker;2019;A mentally troubled stand-up comedian embarks on a downward spiral that leads to the creation of an iconic villain.;335 477 657;738 968 073;1 074 445 730
Star Wars: Episode IX - The Rise of Skywalker;2019;In the riveting conclusion of the landmark Skywalker saga, new legends will be born-and the final battle for freedom is yet to come.;515 202 542;558 946 737;1 074 149 279
Toy Story 4;2019;When a new toy called "Forky" joins Woody and the gang, a road trip alongside old and new friends reveals how big the world can be for a toy.;434 038 008;639 356 585;1 073 394 593
Toy Story 3;2010;The toys are mistakenly delivered to a day-care center instead of the attic right before Andy leaves for college, and it's up to Woody to convince the other toys that they weren't abandoned and to return home.;415 004 880;651 965 931;1 066 970 811
Pirates of the Caribbean: Dead Man's Chest;2006;Jack Sparrow races to recover the heart of Davy Jones to avoid enslaving his soul to Jones' service, as other friends and foes seek the heart for their own agenda as well.;423 315 812;642 863 935;1 066 179 747
The Lion King;1994;Lion prince Simba and his father are targeted by his bitter uncle, who wants to ascend the throne himself.;422 783 777;640 828 028;1 063 611 805
Rogue One: A Star Wars Story;2016;In a time of conflict, a group of unlikely heroes band together on a mission to steal the plans to the Death Star, the Empire's ultimate weapon of destruction.;532 177 324;523 880 396;1 056 057 720
Aladdin;2019;A kind-hearted street urchin and a power-hungry Grand Vizier vie for a magic lamp that has the power to make their deepest wishes come true.;355 559 216;695 134 737;1 050 693 953
Pirates of the Caribbean: On Stranger Tides;2011;Jack Sparrow and Barbossa embark on a quest to find the elusive fountain of youth, only to discover that Blackbeard and his daughter are after it too.;241 071 802;804 642 000;1 045 713 802
Despicable Me 3;2017;Gru meets his long-lost, charming, cheerful, and more successful twin brother Dru, who wants to team up with him for one last criminal heist.;264 624 300;770 175 831;1 034 800 131
Finding Dory;2016;Friendly but forgetful blue tang Dory begins a search for her long-lost parents, and everyone learns a few things about the real meaning of family along the way.;486 295 561;542 275 381;1 028 570 942
Star Wars: Episode I - The Phantom Menace;1999;Two Jedi escape a hostile blockade to find allies and come across a young boy who may bring balance to the Force, but the long dormant Sith resurface to claim their original glory.;474 544 677;552 538 030;1 027 082 707
Alice in Wonderland;2010;Nineteen-year-old Alice returns to the magical world from her childhood adventure, where she reunites with her old friends and learns of her true destiny: to end the Red Queen's reign of terror.;334 191 110;691 277 106;1 025 468 216
Zootopia;2016;In a city of anthropomorphic animals, a rookie bunny cop and a cynical con artist fox must work together to uncover a conspiracy.;341 268 248;682 852 856;1 024 121 104
Harry Potter and the Sorcerer's Stone;2001;An orphaned boy enrolls in a school of wizardry, where he learns the truth about himself, his family and the terrible evil that haunts the magical world.;318 886 962;703 403 056;1 022 290 019
Top Gun: Maverick;2022;After more than thirty years of service as one of the Navy's top aviators, Pete Mitchell is where he belongs, pushing the envelope as a courageous test pilot and dodging the advancement in rank that would ground;534 469 160;486 100 000;1 020 569 160
The Hobbit: An Unexpected Journey;2012;A reluctant Hobbit, Bilbo Baggins, sets out to the Lonely Mountain with a spirited group of dwarves to reclaim their mountain home, and the gold within it from the dragon Smaug.;303 030 651;714 000 000;1 017 030 651
The Dark Knight;2008;When the menace known as the Joker wreaks havoc and chaos on the people of Gotham, Batman must accept one of the greatest psychological and physical tests of his ability to fight injustice.;534 987 076;471 115 201;1 006 102 277
Harry Potter and the Deathly Hallows: Part 1;2010;As Harry, Ron, and Hermione race against time and evil to destroy the Horcruxes, they uncover the existence of the three most powerful objects in the wizarding world: the Deathly Hallows.;296 374 621;680 695 761;977 070 383
Despicable Me 2;2013;When Gru, the world's most super-bad turned super-dad has been recruited by a team of officials to stop lethal muscle and a host of Gru's own, He has to fight back with new gadgetry, cars, and more minion madness.;368 065 385;602 700 620;970 766 005
The Jungle Book;2016;After a threat from the tiger Shere Khan forces him to flee the jungle, a man-cub named Mowgli embarks on a journey of self discovery with the help of panther Bagheera and free-spirited bear Baloo.;364 001 123;602 553 806;966 554 929
Jumanji: Welcome to the Jungle;2017;Four teenagers are sucked into a magical video game, and the only way they can escape is to work together to finish the game.;404 540 171;558 002 774;962 542 945
The Hobbit: The Battle of the Five Armies;2014;Bilbo and company are forced to engage in a war against an array of combatants and keep the Lonely Mountain from falling into the hands of a rising darkness.;255 138 261;707 063 077;962 201 338
Pirates of the Caribbean: At World's End;2007;Captain Barbossa, Will Turner and Elizabeth Swann must sail off the edge of the map, navigate treachery and betrayal, find Jack Sparrow, and make their final alliances for one last decisive battle.;309 420 425;651 576 067;960 996 492
The Hobbit: The Desolation of Smaug;2013;The dwarves, along with Bilbo Baggins and Gandalf the Grey, continue their quest to reclaim Erebor, their homeland, from Smaug. Bilbo Baggins is in possession of a mysterious and magical ring.;258 387 334;700 640 658;959 027 992
Doctor Strange in the Multiverse of Madness;2022;Doctor Strange teams up with a mysterious teenage girl from his dreams who can travel across multiverses, to battle multiple threats, including other-universe versions of himself, which threaten to wipe out millions across the multiverse. They seek help from Wanda the Scarlet Witch, Wong and others.;409 965 571;540 832 836;950 798 407
The Lord of the Rings: The Two Towers;2002;While Frodo and Sam edge closer to Mordor with the help of the shifty Gollum, the divided fellowship makes a stand against Sauron's new ally, Saruman, and his hordes of Isengard.;342 952 511;604 943 730;947 896 241
Harry Potter and the Order of the Phoenix;2007;With their warning about Lord Voldemort's return scoffed at, Harry and Dumbledore are targeted by the Wizard authorities as an authoritarian bureaucrat slowly seizes power at Hogwarts.;292 382 727;649 818 982;942 201 710
Finding Nemo;2003;After his son is captured in the Great Barrier Reef and taken to Sydney, a timid clownfish sets out on a journey to bring him home.;380 843 261;559 509 384;940 352 645
Harry Potter and the Half-Blood Prince;2009;As Harry Potter begins his sixth year at Hogwarts, he discovers an old book marked as "the property of the Half-Blood Prince" and begins to learn more about Lord Voldemort's dark past.;302 334 374;632 148 664;934 483 039
Shrek 2;2004;Shrek and Fiona travel to the Kingdom of Far Far Away, where Fiona's parents are King and Queen, to celebrate their marriage. When they arrive, they find they are not as welcome as they thought they would be.;441 226 247;487 534 523;928 760 770
Bohemian Rhapsody;2018;The story of the legendary British rock band Queen and lead singer Freddie Mercury, leading up to their famous performance at Live Aid.;216 668 042;694 141 269;910 809 311
The Battle at Lake Changjin;2021;Set in the Second Phase Offensive of the Korean War, "The Battle at Lake Changjin" tells an epic historical tale: 71 years ago, the People's Volunteer Army (PVA) entered North Korea for battle. Under extreme freezing conditions, the troops on the Eastern Front pursued with fearless spirit and iron will, as they courageously fought the enemy at Lake Changjin (also known as Chosin Reservoir). The battle was a turning point in the Korean War and demonstrated the courage and resolve of the PVA.;342 411;902 198 524;902 540 935
The Lord of the Rings: The Fellowship of the Ring;2001;A meek Hobbit from the Shire and eight companions set out on a journey to destroy the powerful One Ring and save Middle-earth from the Dark Lord Sauron.;316 115 420;581 979 322;898 094 742
Harry Potter and the Goblet of Fire;2005;Harry Potter finds himself competing in a hazardous tournament between rival schools of magic, but he is distracted by recurring nightmares.;290 469 928;606 260 335;896 730 264
Spider-Man 3;2007;A strange black entity from another world bonds with Peter Parker and causes inner turmoil as he contends with new villains, temptations, and revenge.;336 530 303;558 453 070;894 983 373
Ice Age: Dawn of the Dinosaurs;2009;When Sid's attempt to adopt three dinosaur eggs gets him abducted by their real mother to an underground lost world, his friends attempt to rescue him.;196 573 705;690 113 112;886 686 817
Spectre;2015;A cryptic message from James Bond's past sends him on a trail to uncover the existence of a sinister organisation named SPECTRE. With a new threat dawning, Bond learns the terrible truth about the author of all his pain in his most recent missions.;200 074 609;680 606 910;880 681 519
Spider-Man: Homecoming;2017;Peter Parker balances his life as an ordinary high school student in Queens with his superhero alter-ego Spider-Man, and finds himself on the trail of a new menace prowling the skies of New York City.;334 201 140;545 965 784;880 166 924
Harry Potter and the Chamber of Secrets;2002;An ancient prophecy seems to be coming true when a mysterious presence begins stalking the corridors of a school of magic and leaving its victims paralyzed.;262 641 637;617 286 873;879 928 511
Ice Age: Continental Drift;2012;Manny, Diego, and Sid embark upon another adventure after their continent is set adrift. Using an iceberg as a ship, they encounter sea creatures and battle pirates as they explore a new world.;161 321 843;715 922 939;877 244 782
The Secret Life of Pets;2016;The quiet life of a terrier named Max is upended when his owner takes in Duke, a stray whom Max instantly dislikes.;368 384 330;507 074 301;875 458 631
Batman v Superman: Dawn of Justice;2016;Fearing that the actions of Superman are left unchecked, Batman takes on the Man of Steel, while the world wrestles with what kind of a hero it really needs.;330 360 194;543 277 334;873 637 528
Wolf Warrior 2;2017;China's deadliest special forces operative settles into a quiet life on the sea. When sadistic mercenaries begin targeting nearby civilians, he must leave his newfound peace behind and return to his duties as a soldier and protector.;2 721 100;867 604 339;870 325 439
Star Wars: Episode III - Revenge of the Sith;2005;Three years into the Clone Wars, the Jedi rescue Palpatine from Count Dooku. As Obi-Wan pursues a new threat, Anakin acts as a double agent between the Jedi Council and Palpatine and is lured into a sinister plan to rule the galaxy.;380 270 577;488 119 983;868 390 560
The Hunger Games: Catching Fire;2013;Katniss Everdeen and Peeta Mellark become targets of the Capitol after their victory in the 74th Hunger Games sparks a rebellion in the Districts of Panem.;424 668 047;440 343 699;865 011 746
Guardians of the Galaxy Vol. 2;2017;The Guardians struggle to keep together as a team while dealing with their personal family issues, notably Star-Lord's encounter with his father the ambitious celestial being Ego.;389 813 101;473 942 950;863 756 051
Inside Out;2015;After young Riley is uprooted from her Midwest life and moved to San Francisco, her emotions - Joy, Fear, Anger, Disgust and Sadness - conflict on how best to navigate a new city, house, and school.;356 921 711;501 926 308;858 848 019
Venom;2018;A failed reporter is bonded to an alien entity, one of many symbiotes who have invaded Earth. But the being takes a liking to Earth and decides to protect it.;213 515 506;642 569 645;856 085 151
Thor: Ragnarok;2017;Imprisoned on the planet Sakaar, Thor must race against time to return to Asgard and stop Ragnarök, the destruction of his world, at the hands of the powerful and ruthless villain Hela.;315 058 289;538 925 590;853 983 879
Inception;2010;A thief who steals corporate secrets through the use of dream-sharing technology is given the inverse task of planting an idea into the mind of a C.E.O., but his tragic past may doom the project and his team to disaster.;292 587 330;544 260 772;836 848 102
Transformers: Revenge of the Fallen;2009;Sam Witwicky leaves the Autobots behind for a normal life. But when his mind is filled with cryptic symbols, the Decepticons target him and he is dragged back into the Transformers' war.;402 111 870;434 191 823;836 303 693
The Twilight Saga: Breaking Dawn - Part 2;2012;After the birth of Renesmee/Nessie, the Cullens gather other vampire clans in order to protect the child from a false allegation that puts the family in front of the Volturi.;292 324 737;537 422 917;829 747 654
Spider-Man;2002;When bitten by a genetically modified spider, a nerdy, shy, and awkward high school student gains spider-like abilities that he eventually must use to fight evil as a superhero after tragedy befalls his family.;407 022 860;418 002 176;825 025 036
Wonder Woman;2017;When a pilot crashes and tells of conflict in the outside world, Diana, an Amazonian warrior in training, leaves home to fight a war, discovering her full powers and true destiny.;412 845 172;410 009 114;822 854 286
Hi, Mom;2021;A woman travels back in time to befriend her own mother in an attempt to make her life better.;822 009 764;822 009 764;193 196
Independence Day;1996;The aliens are coming and their goal is to invade and destroy Earth. Fighting superior technology, mankind's best weapon is the will to survive.;306 169 268;511 231 623;817 400 891
Fantastic Beasts and Where to Find Them;2016;The adventures of writer Newt Scamander in New York's secret community of witches and wizards seventy years before Harry Potter reads his book in school.;234 037 575;580 006 426;814 044 001
Shrek the Third;2007;Reluctantly designated as the heir to the land of Far, Far Away, Shrek hatches a plan to install the rebellious Artie as the new king while Princess Fiona tries to fend off a coup d'état by the jilted Prince Charming.;322 719 944;490 647 436;813 367 380
Coco;2017;Aspiring musician Miguel, confronted with his family's ancestral ban on music, enters the Land of the Dead to find his great-great-grandfather, a legendary singer.;210 460 015;597 357 873;807 817 888
Jumanji: The Next Level;2019;In Jumanji: The Next Level, the gang is back but the game has changed. As they return to rescue one of their own, the players will have to brave parts unknown from arid deserts to snowy mountains, to escape the world's most dangerous game.;320 314 960;479 744 747;800 059 707
Harry Potter and the Prisoner of Azkaban;2004;Harry Potter, Ron and Hermione return to Hogwarts School of Witchcraft and Wizardry for their third year of study, where they delve into the mystery surrounding an escaped prisoner who poses a dangerous threat to the young wizard.;250 105 651;547 462 955;797 568 607
Pirates of the Caribbean: Dead Men Tell No Tales;2017;Captain Jack Sparrow is pursued by old rival Captain Salazar and a crew of deadly ghosts who have escaped from the Devil's Triangle. They're determined to kill every pirate at sea...notably Jack.;172 558 876;622 322 566;794 881 442
E.T. the Extra-Terrestrial;1982;A troubled child summons the courage to help a friendly alien escape from Earth and return to his home planet.;435 110 554;304 203 888;792 910 554
Mission: Impossible - Fallout;2018;Ethan Hunt and his IMF team, along with some familiar allies, race against time after a mission gone wrong.;220 159 104;571 498 294;791 657 398
2012;2009;A frustrated writer struggles to keep his family alive when a series of global catastrophes threatens to annihilate mankind.;166 112 167;625 105 659;791 217 826
Indiana Jones and the Kingdom of the Crystal Skull;2008;In 1957, archaeologist and adventurer Dr. Henry "Indiana" Jones, Jr. is called back into action and becomes entangled in a Soviet plot to uncover the secret behind mysterious artifacts known as the Crystal Skulls.;317 101 119;473 552 823;790 653 942
Spider-Man 2;2004;Peter Parker is beset with troubles in his failing personal life as he battles a brilliant scientist named Doctor Otto Octavius.;373 585 825;415 390 628;788 976 453
Fast & Furious 6;2013;Hobbs has Dominic and Brian reassemble their crew to take down a team of mercenaries: Dominic unexpectedly gets sidetracked with facing his presumed deceased girlfriend, Letty.;238 679 850;550 001 118;788 680 968
Deadpool 2;2018;Foul-mouthed mutant mercenary Wade Wilson (a.k.a. Deadpool) assembles a team of fellow mutant rogues to protect a young boy with supernatural abilities from the brutal, time-traveling cyborg Cable.;324 591 735;461 304 874;785 896 609
Deadpool;2016;A wisecracking mercenary gets experimented on and becomes immortal but ugly, and sets out to track down the man who ruined his looks.;363 070 709;419 766 082;782 836 791
Star Wars;1977;Luke Skywalker joins forces with a Jedi Knight, a cocky pilot, a Wookiee and two droids to save the galaxy from the Empire's world-destroying battle station, while also attempting to rescue Princess Leia from the mysterious Darth Vader.;460 998 507;195 751 992;775 398 007
No Time to Die;2021;James Bond has left active service. His peace is short-lived when Felix Leiter, an old friend from the CIA, turns up asking for help, leading Bond onto the trail of a mysterious villain armed with dangerous new technology.;160 891 007;613 262 000;774 153 007
Guardians of the Galaxy;2014;A group of intergalactic criminals must pull together to stop a fanatical warrior with plans to purge the universe.;333 718 600;439 631 547;773 350 147
The Batman;2022;When a sadistic serial killer begins murdering key political figures in Gotham, Batman is forced to investigate the city's hidden corruption and question his family's involvement.;369 345 583;401 490 580;770 836 163
