American Reunion;2012;Jim, Michelle, Stifler, and their friends reunite in East Great Falls, Michigan for their high school reunion.;57 011 521;177 978 063;234 989 584
Big Daddy;1999;A lazy law-school grad adopts a kid to impress his girlfriend, but everything doesn't go as planned and he becomes the unlikely foster father.;163 479 795;71 322 100;234 801 895
Alvin and the Chipmunks: The Road Chip;2015;The Chipmunks believe that Dave plans to propose to his new girlfriend in Miami.--and dump them. They have three days to get to him and save themselves not only from losing Dave but also from gaining a terrible stepbrother.;85 886 987;148 911 649;234 798 636
The Imitation Game;2014;During World War II, the English mathematical genius Alan Turing tries to crack the German Enigma code with help from fellow mathematicians while attempting to come to terms with his troubled private life.;91 125 683;142 430 025;233 555 708
Cruella;2021;A live-action prequel feature film following a young Cruella de Vil.;86 103 234;147 400 000;233 503 234
The Day the Earth Stood Still;2008;A remake of the 1951 classic science fiction film about an alien visitor and his giant robot counterpart who visit Earth.;79 366 978;153 726 881;233 093 859
American Wedding;2003;It's the wedding of Jim and Michelle and the gathering of their families and friends, including Jim's old friends from high school and Michelle's little sister.;104 565 114;128 157 821;232 722 935
The Girl with the Dragon Tattoo;2011;Journalist Mikael Blomkvist is aided in his search for a woman who has been missing for 40 years by young computer hacker Lisbeth Salander.;102 515 793;130 101 637;232 617 430
Juno;2007;Faced with an unplanned pregnancy, an offbeat young woman makes an unusual decision regarding the unborn child.;143 495 265;88 877 416;232 372 681
Argo;2012;Acting under the cover of a Hollywood producer scouting a location for a science fiction film, a CIA agent launches a dangerous operation to rescue six Americans in Tehran during the U.S. hostage crisis in Iran in 1979.;136 025 503;96 300 000;232 325 503
Mr. Bean's Holiday;2007;Mr. Bean wins a trip to Cannes where he unwittingly separates a young boy from his father and must help the two reunite. On the way he discovers France, bicycling, and true love.;33 302 167;198 923 741;232 225 908
The English Patient;1996;At the close of World War II, a young nurse tends to a badly-burned plane crash victim. His past is shown in flashbacks, revealing an involvement in a fateful love affair.;78 676 425;153 300 000;231 976 425
Sister Act;1992;When a nightclub singer is forced to take refuge from the mob in a convent, she ends up turning the convent choir into a soulful chorus complete with a Motown repertoire, until the sudden celebrity of the choir jeopardizes her identity.;139 605 150;92 000 000;231 605 150
Annabelle Comes Home;2019;While babysitting the daughter of Ed and Lorraine Warren, a teenager and her friend unknowingly awaken an evil spirit trapped in a doll.;74 152 591;157 100 000;231 252 591
Constantine;2005;Supernatural exorcist and demonologist John Constantine helps a policewoman prove her sister's death was not a suicide, but something more.;75 976 178;154 908 550;230 884 728
Get Smart;2008;Maxwell Smart, a highly intellectual but bumbling spy working for the CONTROL agency, is tasked with preventing a terrorist attack from rival spy agency KAOS.;130 319 208;100 366 245;230 685 453
Space Jam;1996;In a desperate attempt to win a basketball match and earn their freedom, the Looney Tunes seek the aid of retired basketball champion, Michael Jordan.;90 594 962;140 000 000;230 594 962
Life Is Beautiful;1997;When an open-minded Jewish waiter and his son become victims of the Holocaust, he uses a perfect mixture of will, humor, and imagination to protect his son from the dangers around their camp.;57 563 264;172 535 489;230 098 753
The Heat;2013;An uptight FBI Special Agent is paired with a foul-mouthed Boston cop to take down a ruthless drug lord.;159 582 188;70 348 583;229 930 771
Ghostbusters;2016;Following a ghost invasion of Manhattan, paranormal enthusiasts Erin Gilbert and Abby Yates, nuclear engineer Jillian Holtzmann, and subway worker Patty Tolan band together to stop the otherworldly threat.;128 350 574;100 796 935;229 147 509
Ghost Rider;2007;When motorcycle rider Johnny Blaze sells his soul to the Devil to save his father's life, he is transformed into the Ghost Rider, the Devil's own bounty hunter, and is sent to hunt down sinners.;115 802 596;112 935 797;228 738 393
Goodbye Mr. Loser;2015;After attending a wedding of his high school crush Qiuya, Xia Luo (Shen Teng) gets drunk embarrassing himself and angers his wife Ma Dongmei (Ma Li).;1 293 626;226 829 302;228 122 928
Paddington 2;2017;Paddington, now happily settled with the Brown family and a popular member of the local community, picks up a series of odd jobs to buy the perfect present for his Aunt Lucy's 100th birthday, only for the gift to be stolen.;40 907 738;187 087 054;227 994 792
Sleepless in Seattle;1993;A recently widowed man's son calls a radio talk-show in an attempt to find his father a partner.;126 808 165;101 119 000;227 927 165
Lethal Weapon 2;1989;Riggs and Murtaugh are on the trail of South African diplomats who are using their immunity to engage in criminal activities.;147 253 986;80 600 000;227 853 986
The Green Hornet;2011;Following the death of his father, Britt Reid, heir to his father's large company, teams up with his late dad's assistant Kato to become a masked crime fighting team.;98 780 042;129 037 206;227 817 248
Out of Africa;1985;In 20th-century colonial Kenya, a Danish baroness/plantation owner has a passionate love affair with a free-spirited big-game hunter.;87 071 205;140 443 000;227 514 205
Youth;2017;A look at the lives of members of a Military Cultural Troupe in the 1970s.;1 891 956;225 199 334;227 091 290
Baby Driver;2017;After being coerced into working for a crime boss, a young getaway driver finds himself taking part in a heist doomed to fail.;107 825 862;119 119 225;226 945 087
Immortals;2011;Theseus is a mortal man chosen by Zeus to lead the fight against the ruthless King Hyperion, who is on a rampage across Greece to obtain a weapon that can destroy humanity.;83 504 017;143 400 000;226 904 017
Taken;2008;A retired CIA agent travels across Europe and relies on his old skills to save his estranged daughter, who has been kidnapped while on a trip to Paris.;145 000 989;81 836 771;226 837 760
Percy Jackson & the Olympians: The Lightning Thief;2010;A teenager discovers he's the descendant of a Greek god and sets out on an adventure to settle an on-going battle between the gods.;88 768 303;137 728 906;226 497 209
Hansel & Gretel: Witch Hunters;2013;Brother/sister duo Hansel and Gretel are professional witch-hunters who help innocent villagers. One day they stumble upon a case that could hold the key to their past.;55 703 475;170 646 274;226 349 749
Valerian and the City of a Thousand Planets;2017;A dark force threatens Alpha, a vast metropolis and home to species from a thousand planets. Special operatives Valerian and Laureline must race to identify the marauding menace and safeguard not just Alpha, but the future of the universe.;41 189 488;184 783 852;225 973 340
Good Will Hunting;1997;Will Hunting, a janitor at M.I.T., has a gift for mathematics, but needs help from a psychologist to find direction in his life.;138 433 435;87 500 000;225 933 435
Better Days;2019;A bullied teenage girl forms an unlikely friendship with a mysterious young man who protects her from her assailants, all while she copes with the pressures of her final examinations.;1 921 657;223 997 141;225 918 798
Ford v Ferrari;2019;American car designer Carroll Shelby and driver Ken Miles battle corporate interference and the laws of physics to build a revolutionary race car for Ford in order to defeat Ferrari at the 24 Hours of Le Mans in 1966.;117 624 357;107 883 853;225 508 210
Jumper;2008;A teenager with teleportation abilities suddenly finds himself in the middle of an ancient war between those like him and their sworn annihilators.;80 172 128;144 959 985;225 132 113
Elf;2003;Raised as an oversized elf, Buddy travels from the North Pole to New York City to meet his biological father, Walter Hobbs, who doesn't know he exists and is in desperate need of some Christmas spirit.;177 874 109;47 223 328;225 097 437
The Social Network;2010;As Harvard student Mark Zuckerberg creates the social networking site that would become known as Facebook, he is sued by the twins who claimed he stole their idea, and by the co-founder who was later squeezed out of the business.;96 962 694;127 957 681;224 920 375
Chicken Run;2000;When a cockerel apparently flies into a chicken farm, the chickens see him as an opportunity to escape their evil owners.;106 834 564;118 000 000;224 834 564
Con Air;1997;Newly-paroled ex-con and former U.S. Ranger Cameron Poe finds himself trapped in a prisoner-transport plane when the passengers seize control.;101 117 573;122 894 661;224 012 234
Interview with the Vampire: The Vampire Chronicles;1994;A vampire tells his epic life story: love, betrayal, loneliness, and hunger.;105 264 608;118 400 000;223 664 608
Flightplan;2005;A bereaved woman and her daughter are flying home from Berlin to America. At 30,000 feet, the child vanishes, and nobody will admit she was ever on the plane.;89 707 299;133 680 000;223 387 299
Yes Man;2008;A man challenges himself to say "yes" to everything.;97 690 976;125 550 661;223 241 637
Non-Stop;2014;An air marshal springs into action during a transatlantic flight after receiving a series of text messages demanding $150 million into an off-shore account, or someone will die every 20 minutes.;92 168 600;130 641 000;222 809 600
Honey, I Shrunk the Kids;1989;The scientist father of a teenage girl and boy accidentally shrinks his and two other neighborhood teens to the size of insects. Now the teens must fight diminutive dangers as the father searches for them.;130 724 172;92 000 000;222 724 172
Fahrenheit 9/11;2004;Michael Moore's view on what happened to the United States after September 11 and how the Bush Administration allegedly used the tragic event to push forward its agenda for unjust wars in Afghanistan and Iraq.;119 194 771;103 252 111;222 446 882
Wild Wild West;1999;The two best special agents in the Wild West must save President Grant from the clutches of a diabolical, wheelchair-bound, steampunk-savvy, Confederate scientist bent on revenge for losing the Civil War.;113 804 681;108 300 000;222 104 681
My Country, My Parents;2021;Included as the third installment of "National Day Celebration" trilogy with My People, My Country (2019) and My People, My Homeland (2020), My Country, My Parents focuses on four Chinese families in four different eras. Combined with 4 stories, through the perspective of "home" and "country", representing several generations of our predecessors' dedication and sacrifice. The whole movie bring back the audiences to the collective memories of our country, as well as the ordinary and great parental affection between every generation.;166 807;221 548 909;221 715 716
Geostorm;2017;When the network of satellites designed to control the global climate starts to attack Earth, it's a race against the clock for its creator to uncover the real threat before a worldwide Geostorm wipes out everything and everyone.;33 700 160;187 900 000;221 600 160
Presumed Innocent;1990;As a lawyer investigates the murder of a colleague, he finds himself more connected to the crime than anyone else.;86 303 188;135 000 000;221 303 188
Jungle Cruise;2021;Based on Disneyland's theme park ride where a small riverboat takes a group of travelers through a jungle filled with dangerous animals and reptiles but with a supernatural element.;116 987 516;103 901 930;220 889 446
Scary Movie 3;2003;Cindy must investigate mysterious crop circles and video tapes, and help the President in preventing an alien invasion.;110 003 217;110 670 000;220 673 217
Collateral;2004;A cab driver finds himself the hostage of an engaging contract killer as he makes his rounds from hit to hit during one night in Los Angeles.;101 005 703;119 234 222;220 239 925
Inferno;2016;When Robert Langdon wakes up in an Italian hospital with amnesia, he teams up with Dr. Sienna Brooks and they race across Europe together against the clock to foil a deadly global plot.;34 343 574;185 677 685;220 021 259
Knocked Up;2007;For fun-loving party animal Ben Stone, the last thing he ever expected was for his one-night stand to show up on his doorstep eight weeks later to tell him she's pregnant with his child.;148 768 917;71 153 500;219 922 417
Green Lantern;2011;Reckless test pilot Hal Jordan is granted an alien ring that bestows him with otherworldly powers that inducts him into an intergalactic police force, the Green Lantern Corps.;116 601 172;103 250 000;219 851 172
What Happens in Vegas;2008;A man and a woman are compelled, for legal reasons, to live life as a couple for a limited period of time. At stake is a large amount of money.;80 277 646;139 097 916;219 375 562
It's Complicated;2009;When attending their son's college graduation, a couple reignite the spark in their relationship. But the complicated fact is they're divorced and he's remarried.;112 735 375;106 368 280;219 103 655
The Terminal;2004;An Eastern European tourist unexpectedly finds himself stranded in JFK airport, and must take up temporary residence there.;77 872 883;141 227 201;219 100 084
Captain Phillips;2013;The true story of Captain Richard Phillips and the 2009 hijacking by Somali pirates of the U.S.-flagged MV Maersk Alabama, the first American cargo ship to be hijacked in two hundred years.;107 100 855;111 690 956;218 791 811
The Prince of Egypt;1998;Egyptian Prince Moses learns of his identity as a Hebrew and his destiny to become the chosen deliverer of his people.;101 413 188;117 200 000;218 613 188
Jack Reacher;2012;A homicide investigator digs deeper into a case involving a trained military sniper responsible for a mass shooting.;80 070 736;138 269 859;218 340 595
Kingdom of Heaven;2005;Balian of Ibelin travels to Jerusalem during the Crusades of the 12th century, and there he finds himself as the defender of the city and its people.;47 398 413;170 724 214;218 122 627
The Emoji Movie;2017;Gene, a multi-expressional emoji, sets out on a journey to become a normal emoji.;86 089 513;131 687 133;217 776 646
Too Cool to Kill;2022;In order to fully realize his dream of being a comedian, Wei Chenggong (Wei Xiang) accidentally broke into a dangerous scam under the "persuasion" of actress Milan (Li Ma). But Wei Chenggong didn't know he was already involved in another real and ridiculous plot.;185 882;217 068 722;217 254 604
Dracula Untold;2014;As his kingdom is being threatened by the Turks, young prince Vlad Tepes must become a monster feared by his own people in order to obtain the power needed to protect his own family, and the families of his kingdom.;56 280 355;160 843 925;217 124 280
Central Intelligence;2016;After he reconnects with an awkward pal from high school through Facebook, a mild-mannered accountant is lured into the world of international espionage.;127 440 871;89 531 672;216 972 543
Million Dollar Baby;2004;A determined woman works with a hardened boxing trainer to become a professional.;100 492 203;116 271 443;216 763 646
The Help;2011;An aspiring author during the civil rights movement of the 1960s decides to write a book detailing the African American maids' point of view on the white families for which they work, and the hardships they go through on a daily basis.;169 708 112;46 931 000;216 639 112
Twins;1988;A physically perfect but innocent man goes in search of his long-lost twin brother, who is short, a womanizer, and small-time crook.;111 938 388;104 676 000;216 614 388
Little Women;2019;Jo March reflects back and forth on her life, telling the beloved story of the March sisters - four young women, each determined to live life on her own terms.;108 101 214;108 500 000;216 601 214
Valentine's Day;2010;Intertwining couples and singles in Los Angeles break-up and make-up based on the pressures and expectations of Valentine's Day.;110 528 528;106 000 000;216 528 528
Bad Teacher;2011;A lazy, incompetent middle school teacher who hates her job, her students, and her co-workers is forced to return to teaching to make enough money for breast implants after her wealthy fiancé dumps her.;100 292 856;115 904 636;216 197 492
A Little Red Flower;2020;The film tells a warm and realistic story, thinking and facing the ultimate problem that every ordinary person will face-imagining that death may come at any time, the only thing we have to do is love and cherish.;216 000 000;216 000 000;80 100 000
The Croods: A New Age;2020;The prehistoric family the Croods are challenged by a rival family the Bettermans, who claim to be better and more evolved.;58 568 815;157 337 000;215 905 815
Clear and Present Danger;1994;CIA Analyst Jack Ryan is drawn into an illegal war fought by the US government against a Colombian drug cartel.;122 187 717;93 700 000;215 887 717
One Hundred and One Dalmatians;1961;When a litter of Dalmatian puppies are abducted by the minions of Cruella De Vil, the owners must find them before she uses them for a diabolical fashion statement.;144 880 014;71 000 000;215 880 014
Ted 2;2015;Newlywed couple Ted and Tami-Lynn want to have a baby, but in order to qualify to be a parent, Ted will have to prove he's a person in a court of law.;81 476 385;134 387 221;215 863 606
Bram Stoker's Dracula;1992;The centuries old vampire Count Dracula comes to England to seduce his barrister Jonathan Harker's fiancée Mina Murray and inflict havoc in the foreign land.;82 522 790;133 339 902;215 862 692
Vertical Limit;2000;A climber must rescue his sister on top of K2, one of the world's biggest mountains.;69 243 859;146 420 000;215 663 859
Ghostbusters II;1989;The discovery of a massive river of ectoplasm and a resurgence of spectral activity allows the staff of Ghostbusters to revive the business.;112 494 738;102 900 000;215 394 738
The Patriot;2000;Peaceful farmer Benjamin Martin is driven to lead the Colonial Militia during the American Revolution when a sadistic British officer murders his son.;113 330 342;101 964 000;215 294 342
The Sorcerer's Apprentice;2010;Balthazar Blake, an apprentice of the legendary magician Merlin, must train his old teacher's successor - an introverted but resourceful physics prodigy - in the art of sorcery to prevent the return of Morgana le Fay.;63 150 991;152 132 751;215 283 742
Just Go with It;2011;On a weekend trip to Hawaii, a plastic surgeon convinces his loyal assistant to pose as his soon-to-be-divorced wife in order to cover up a careless lie he told to his much-younger girlfriend.;103 028 109;111 917 482;214 945 591
The Expendables 3;2014;Barney augments his team with new blood for a personal battle: to take down Conrad Stonebanks, the Expendables co-founder and notorious arms trader who is hell bent on wiping out Barney and every single one of his associates.;39 322 544;175 335 033;214 657 577
Dirty Dancing;1987;Spending the summer at a Catskills resort with her family, Frances "Baby" Houseman falls in love with the camp's dance instructor, Johnny Castle.;64 577 242;150 000 000;214 577 242
Creed II;2018;Under the tutelage of Rocky Balboa, newly crowned heavyweight champion Adonis Creed faces off against Viktor Drago, the son of Ivan Drago.;115 715 889;98 500 000;214 215 889
Smallfoot;2018;A Yeti is convinced that the elusive creatures known as "humans" really do exist.;83 315 531;130 800 000;214 115 531
Public Enemies;2009;The Feds try to take down notorious American gangsters John Dillinger, Baby Face Nelson, and Pretty Boy Floyd during a booming crime wave in the 1930s.;97 104 620;117 000 000;214 104 620
The Bourne Identity;2002;A man is picked up by a fishing boat, bullet-riddled and suffering from amnesia, before racing to elude assassins and attempting to regain his memory.;121 661 683;92 372 541;214 034 224
Disclosure;1994;A computer specialist is sued for sexual harassment by a former lover turned boss who initiated the act forcefully, which threatens both his career and his personal life.;83 015 089;131 000 000;214 015 089
Pulp Fiction;1994;The lives of two mob hitmen, a boxer, a gangster and his wife, and a pair of diner bandits intertwine in four tales of violence and redemption.;107 928 762;106 000 000;213 928 762
The Aviator;2004;A biopic depicting the early years of legendary director and aviator Howard Hughes' career from the late 1920s to the mid 1940s.;102 610 330;111 109 612;213 719 942
Crouching Tiger, Hidden Dragon;2000;A young Chinese warrior steals a sword from a famed swordsman and then escapes into a world of romantic adventure with a mysterious man in the frontier of the nation.;128 078 872;85 446 864;213 525 736
Braveheart;1995;Scottish warrior William Wallace leads his countrymen in a rebellion to free his homeland from the tyranny of King Edward I of England.;75 609 945;137 606 271;213 216 216
Into the Woods;2014;A witch tasks a childless baker and his wife with procuring magical items from classic fairy tales to reverse the curse put on their family tree.;128 002 372;84 900 000;212 902 372
Bedtime Stories;2008;A hotel handyman's life changes when the lavish bedtime stories he tells his niece and nephew start to magically come true.;110 101 975;102 772 889;212 874 864
Miss Congeniality;2000;An F.B.I. Agent must go undercover in the Miss United States beauty pageant to prevent a group from bombing the event.;106 807 667;105 935 053;212 742 720
Entrapment;1999;An insurance agent is sent by her employer to track down and help capture an art thief.;87 704 396;124 700 000;212 404 396
Ace Ventura: When Nature Calls;1995;Ace Ventura, Pet Detective, returns from a spiritual quest to investigate the disappearance of a rare white bat, the sacred animal of a tribe in Africa.;108 385 533;104 000 000;212 385 533
End of Days;1999;At the end of the century, Satan visits New York in search of a bride. It's up to an ex-cop who now runs an elite security outfit to stop him.;66 889 043;145 100 000;211 989 043
Bridget Jones's Baby;2016;Forty-something and single again, Bridget decides to focus on her job and surround herself with friends. In a twist, she finds herself pregnant, but with one hitch - she can only be fifty percent sure of the identity of her baby's father.;24 252 420;187 700 000;211 952 420
Fury;2014;A grizzled tank commander makes tough decisions as he and his crew fight their way across Germany in April, 1945.;85 817 906;126 004 791;211 822 697
Battle Los Angeles;2011;A squad of U.S. Marines becomes the last line of defense against a global invasion.;83 552 429;128 266 925;211 819 354
Australia;2008;Set in northern Australia before WWII, an Englishwoman who inherits a sprawling ranch reluctantly pacts with a stock-man in order to drive 2,000 head of cattle over unforgiving landscapes.;49 554 002;162 233 509;211 787 511
Due Date;2010;High-strung father-to-be Peter Highman is forced to hitch a ride with aspiring actor Ethan Tremblay on a road trip in order to make it to his child's birth on time.;100 539 043;111 241 781;211 780 824
Master and Commander: The Far Side of the World;2003;During the Napoleonic Wars, a brash British captain pushes his ship and crew to their limits in pursuit of a formidable French war vessel around South America.;93 927 920;117 694 615;211 622 535
A Series of Unfortunate Events;2004;When a massive fire kills their parents, three children are delivered to the custody of cousin and stage actor Count Olaf, who is secretly plotting to steal their parents' vast fortune.;118 634 549;92 833 686;211 468 235
The Little Mermaid;1989;A mermaid princess makes a Faustian bargain in an attempt to become human and win a prince's love.;111 543 479;99 800 000;211 343 479
Nice View;2022;20-year-old Jing Hao came to Shenzhen to live with his young sister alone. The siblings live a warm yet straitened life. In an effort to pay for his sister's expensive surgery, Jing Hao gets an opportunity by chance, thinking that a better life is coming, but unexpectedly encounters a serious setback. Under the pressure of both time and money, Jing Hao, who has no way out, decides to take a desperate gamble. Can this ignite the spark of hope for his troubled ordinary life?;211 019 042;211 019 042;8 422
District 9;2009;Violence ensues after an extraterrestrial race forced to live in slum-like conditions on Earth finds a kindred spirit in a government agent exposed to their biotechnology.;115 646 235;95 242 715;210 888 950
Moonraker;1979;James Bond investigates the mid-air theft of a space shuttle, and discovers a plot to commit global genocide.;70 308 099;140 000 000;210 308 099
The Others;2001;A woman who lives in her darkened old family house with her two photosensitive children becomes convinced that the home is haunted.;96 522 687;113 424 350;209 947 037
Horrible Bosses;2011;Three friends conspire to murder their awful bosses when they realize they are standing in the way of their happiness.;117 538 559;92 300 000;209 838 559
Us and Them;2018;During the hectic chunyun period, 2 strangers traveling home meet on the train.;209 221 380;209 221 380;49
Red Dragon;2002;A retired FBI agent with psychological gifts is assigned to help track down "The Tooth Fairy", a mysterious serial killer. Aiding him is imprisoned forensic psychiatrist Dr. Hannibal "The Cannibal" Lecter.;93 149 898;116 046 400;209 196 298
